{
  "$schema": "../vendors.schema.json",
  "id": "keithley_dmm6500",
  "kind": "Dmm",
  "manufacturerGlob": "Keithley*",
  "modelGlob": "DMM6500",
  "channels": 1,
  "commands": {
    "measure_voltage_dc": ":SENS:FUNC \"VOLT:DC\";:READ?",
    "measure_voltage_ac": ":SENS:FUNC \"VOLT:AC\";:READ?",
    "measure_current_dc": ":SENS:FUNC \"CURR:DC\";:READ?",
    "measure_current_ac": ":SENS:FUNC \"CURR:AC\";:READ?",
    "measure_resistance_2w": ":SENS:FUNC \"RES\";:READ?",
    "measure_resistance_4w": ":SENS:FUNC \"FRES\";:READ?",
    "measure_temperature": ":SENS:FUNC \"TEMP\";:READ?"
  }
}
